"Sl.No","Documents","Status"
"1","Average Grade point (last 3 years data of students' CGPA)","Pending"
"2","Accreditation reports of past visits","Pending"
"3","Placements and higher studies data","Pending"
"4","Curriculum,POs,PEOs,Mission and Vision statements","Pending"
"5","Direct and indirect assessment to show attainment of POs and PSOs","Pending"
"6","Details of faculty student ratio","Pending"
"7","List of students who cleared the program in 4 years","Pending"
"8","Department budget and allocations","Pending"
